{
  "atlas_schema": "atlas-world/0.1",
  "metadata": {
    "id": "restaurant-v0",
    "name": "Synthetic counter-service restaurant (ATLAS V0 proving ground)",
    "version": "0.1.0",
    "domain": "restaurant",
    "description": "Five kitchen stations, five line staff plus a manager, two fryers, one grill. Exists only to prove the ATLAS architecture. Every number is a demo parameter, not a business claim.",
    "status": "synthetic",
    "authors": ["ATLAS V0 spec"],
    "created": "2026-10-07"
  },
  "time": {
    "unit": "second",
    "timezone": "America/Los_Angeles",
    "origin": "2026-10-06T17:00:00-07:00",
    "end": "2026-10-06T20:30:00-07:00"
  },
  "entity_types": [
    { "id": "person",    "attributes": ["role", "skills", "hourly_cost"] },
    { "id": "station",   "attributes": ["area", "staffing", "per_staff_concurrency", "overload_queue", "overload_wait_s"] },
    { "id": "equipment", "attributes": ["station", "capacity", "status"] },
    { "id": "area",      "attributes": [] },
    { "id": "product",   "attributes": ["price", "process"] },
    { "id": "order",     "attributes": ["channel", "items", "total"], "dynamic": true },
    { "id": "work_item", "attributes": ["order", "item", "station", "step"], "dynamic": true }
  ],
  "entities": [
    { "id": "area_dining",  "type": "area", "name": "Dining" },
    { "id": "area_kitchen", "type": "area", "name": "Kitchen" },
    { "id": "area_pickup",  "type": "area", "name": "Pickup" },

    { "id": "st_prep",  "type": "station", "name": "Prep",  "attrs": { "area": "area_kitchen", "staffing": "required", "per_staff_concurrency": 2, "overload_queue": 6, "overload_wait_s": 240 } },
    { "id": "st_grill", "type": "station", "name": "Grill", "attrs": { "area": "area_kitchen", "staffing": "required", "per_staff_concurrency": 4, "overload_queue": 6, "overload_wait_s": 240 } },
    { "id": "st_fry",   "type": "station", "name": "Fry",   "attrs": { "area": "area_kitchen", "staffing": "required", "per_staff_concurrency": 3, "overload_queue": 6, "overload_wait_s": 240 } },
    { "id": "st_pass",  "type": "station", "name": "Pass / Assembly", "attrs": { "area": "area_kitchen", "staffing": "required", "per_staff_concurrency": 2, "overload_queue": 6, "overload_wait_s": 240 } },

    { "id": "eq_prep_table_1", "type": "equipment", "name": "Prep table",  "attrs": { "station": "st_prep",  "capacity": 4, "status": "OPERATIONAL" } },
    { "id": "eq_grill_1",      "type": "equipment", "name": "Flat-top grill", "attrs": { "station": "st_grill", "capacity": 8, "status": "OPERATIONAL" } },
    { "id": "eq_fryer_1",      "type": "equipment", "name": "Fryer 1",      "attrs": { "station": "st_fry",   "capacity": 3, "status": "OPERATIONAL" } },
    { "id": "eq_fryer_2",      "type": "equipment", "name": "Fryer 2",      "attrs": { "station": "st_fry",   "capacity": 3, "status": "OPERATIONAL" } },

    { "id": "emp_01", "type": "person", "name": "Dana",   "attrs": { "role": "cook",    "skills": ["prep", "grill", "pass"], "hourly_cost": 22 } },
    { "id": "emp_02", "type": "person", "name": "Luis",   "attrs": { "role": "cook",    "skills": ["grill", "fry"],          "hourly_cost": 22 } },
    { "id": "emp_03", "type": "person", "name": "Priya",  "attrs": { "role": "cook",    "skills": ["fry", "prep"],           "hourly_cost": 22 } },
    { "id": "emp_04", "type": "person", "name": "Marcus", "attrs": { "role": "cook",    "skills": ["prep", "fry", "pass"],   "hourly_cost": 22 } },
    { "id": "emp_05", "type": "person", "name": "Jo",     "attrs": { "role": "expo",    "skills": ["pass"],                  "hourly_cost": 20 } },
    { "id": "emp_06", "type": "person", "name": "Sam",    "attrs": { "role": "manager", "skills": ["prep", "grill", "fry", "pass"], "hourly_cost": 30 } },

    { "id": "prod_burger",  "type": "product", "name": "Burger",           "attrs": { "price": 11.50, "process": "proc_burger" } },
    { "id": "prod_chicken", "type": "product", "name": "Chicken sandwich", "attrs": { "price": 12.00, "process": "proc_chicken" } },
    { "id": "prod_salad",   "type": "product", "name": "Salad",            "attrs": { "price": 9.00,  "process": "proc_salad" } },
    { "id": "prod_fries",   "type": "product", "name": "Fries",            "attrs": { "price": 4.00,  "process": "proc_fries" } },
    { "id": "prod_drink",   "type": "product", "name": "Drink",            "attrs": { "price": 2.50,  "process": null } }
  ],
  "relationships": [
    { "type": "located_in",  "from": "st_prep",  "to": "area_kitchen" },
    { "type": "located_in",  "from": "st_grill", "to": "area_kitchen" },
    { "type": "located_in",  "from": "st_fry",   "to": "area_kitchen" },
    { "type": "located_in",  "from": "st_pass",  "to": "area_kitchen" },
    { "type": "attached_to", "from": "eq_prep_table_1", "to": "st_prep" },
    { "type": "attached_to", "from": "eq_grill_1",      "to": "st_grill" },
    { "type": "attached_to", "from": "eq_fryer_1",      "to": "st_fry" },
    { "type": "attached_to", "from": "eq_fryer_2",      "to": "st_fry" },
    { "type": "reports_to",  "from": "emp_01", "to": "emp_06" },
    { "type": "reports_to",  "from": "emp_02", "to": "emp_06" },
    { "type": "reports_to",  "from": "emp_03", "to": "emp_06" },
    { "type": "reports_to",  "from": "emp_04", "to": "emp_06" },
    { "type": "reports_to",  "from": "emp_05", "to": "emp_06" }
  ],
  "aliases": {
    "staffhub": { "EMP001": "emp_01", "EMP002": "emp_02", "EMP003": "emp_03", "EMP004": "emp_04", "EMP005": "emp_05", "EMP006": "emp_06",
                  "PREP": "st_prep", "GRILL": "st_grill", "FRY": "st_fry", "PASS": "st_pass" },
    "kds":      { "PREP": "st_prep", "GRILL": "st_grill", "FRY": "st_fry", "PASS": "st_pass" },
    "iot":      { "FRY-01": "eq_fryer_1", "FRY-02": "eq_fryer_2", "GRL-01": "eq_grill_1" },
    "pos":      { "BRG": "prod_burger", "CHK": "prod_chicken", "SAL": "prod_salad", "FRY": "prod_fries", "DRK": "prod_drink" }
  },
  "processes": [
    { "id": "proc_burger",  "applies_to": "prod_burger",  "steps": [ { "id": "prep",  "station": "st_prep",  "duration_s": 90 },  { "id": "grill", "station": "st_grill", "duration_s": 240 } ] },
    { "id": "proc_chicken", "applies_to": "prod_chicken", "steps": [ { "id": "prep",  "station": "st_prep",  "duration_s": 90 },  { "id": "fry",   "station": "st_fry",   "duration_s": 300 } ] },
    { "id": "proc_salad",   "applies_to": "prod_salad",   "steps": [ { "id": "prep",  "station": "st_prep",  "duration_s": 150 } ] },
    { "id": "proc_fries",   "applies_to": "prod_fries",   "steps": [ { "id": "fry",   "station": "st_fry",   "duration_s": 210 } ] },
    { "id": "proc_order",   "applies_to": "order",        "steps": [ { "id": "pass",  "station": "st_pass",  "duration_s": 90, "requires": "all_items_complete" } ],
      "handoff_s": 60 }
  ],
  "rules": [
    { "id": "R01", "kind": "station_capacity",   "description": "effective capacity = 0 if a staffing-required station has no assigned on-shift employee; otherwise min(sum of capacity of attached equipment whose status is not DOWN, staff_count * per_staff_concurrency)." },
    { "id": "R02", "kind": "queue_discipline",   "description": "FIFO by (queued_t, order created_t, work_id). No preemption. No priority classes in V0." },
    { "id": "R03", "kind": "no_preemption",      "description": "Work in progress always finishes, even if capacity drops below the in-progress count. No new work starts while in_progress >= effective capacity." },
    { "id": "R04", "kind": "single_assignment",  "description": "An employee is assigned to at most one station at a time. A reassignment takes effect at the event time; in-progress work at the old station continues (R03)." },
    { "id": "R05", "kind": "assembly_barrier",   "description": "The order-level pass step is queued only when every item's last kitchen step is complete (immediately at creation for orders with no kitchen steps)." },
    { "id": "R06", "kind": "handoff",            "description": "ORDER_COMPLETED occurs handoff_s after ORDER_READY. No staff needed." },
    { "id": "R07", "kind": "station_status",     "description": "UNSTAFFED if staff=0 and queue>0; OVERLOADED if queue_len >= overload_queue or oldest queued wait >= overload_wait_s; BUSY if in_progress >= effective capacity and capacity>0; else NORMAL." },
    { "id": "R08", "kind": "skills_required",    "description": "An employee may only be assigned to a station listed in their skills. Violations are rejected at validation, not silently ignored." },
    { "id": "R09", "kind": "no_balking",         "description": "V0 models no lost demand: every created order is eventually served. Revenue differences between branches are timing differences, not gained revenue." }
  ],
  "initial_state": {
    "clock_in": ["emp_01", "emp_02", "emp_03", "emp_04", "emp_05", "emp_06"],
    "assignments": { "emp_01": "st_prep", "emp_02": "st_grill", "emp_03": "st_fry", "emp_04": "st_prep", "emp_05": "st_pass", "emp_06": null },
    "equipment": { "eq_prep_table_1": "OPERATIONAL", "eq_grill_1": "OPERATIONAL", "eq_fryer_1": "OPERATIONAL", "eq_fryer_2": "OPERATIONAL" }
  },
  "scheduled_events": [],
  "arrival_model": {
    "kind": "piecewise_poisson",
    "note": "Used only when a run generates its own arrivals (COMPOSE / forward simulation). The demo branch replays historical arrivals instead.",
    "segments": [
      { "from": "17:00", "to": "17:30", "orders_per_hour": 18 },
      { "from": "17:30", "to": "18:00", "orders_per_hour": 26 },
      { "from": "18:00", "to": "18:15", "orders_per_hour": 38 },
      { "from": "18:15", "to": "19:30", "orders_per_hour": 50 },
      { "from": "19:30", "to": "20:00", "orders_per_hour": 30 },
      { "from": "20:00", "to": "20:30", "orders_per_hour": 16 }
    ],
    "order_mix": {
      "mains":        { "prod_burger": 0.55, "prod_chicken": 0.30, "prod_salad": 0.15 },
      "second_main_p": 0.25,
      "fries_p": 0.70,
      "drink_p": 0.60,